job_name_jobs_list,company_name,job_page_link,jobs_country_jobs_list,posted_date,deadline,job_salary_jobs_list,job_page_full_url,job_name_job_page,company_name_job_page,job_country_job_page,job_time_job_page,job_salary_job_page,job_category,job_overview,job_description_details,company_reg_date,company_phone,active_job
Sales,MALISU APOLLO INVESTMENTS LTD,./jobs?id=6613,Uganda,"Posted : 03 Jan, 2025","Deadline : 26 Jan, 2025",AED 1200,https://eemis.mglsd.go.ug/jobs?id=6613,Sales,MALISU APOLLO INVESTMENTS LTD,United Arab Emirates,"Jan 03, 2025 - Jan 03, 2027 ",AED 1200,Sales/Business Development,"The sales personnel will be responsible for Answering client questions about credit terms, products, prices, availability and Preparing and submitting sales contracts for orders and Visiting clients and potential clients to evaluate needs or promote products and services.","The sales personnel will be responsible for Answering client questions about credit terms, products, prices, availability and Preparing and submitting sales contracts for orders and Visiting clients and potential clients to evaluate needs or promote products and services.","14 March, 2024",+256-773-001186,False
Sales,MALISU APOLLO INVESTMENTS LTD,./jobs?id=6613,United Arab Emirates,"03 Jan, 2025 - 03 Jan, 2027","Deadline : 26 Jan, 2025",AED 1200,https://eemis.mglsd.go.ug/jobs?id=6613,Sales,MALISU APOLLO INVESTMENTS LTD,United Arab Emirates,"Jan 03, 2025 - Jan 03, 2027 ",AED 1200,Sales/Business Development,"The sales personnel will be responsible for Answering client questions about credit terms, products, prices, availability and Preparing and submitting sales contracts for orders and Visiting clients and potential clients to evaluate needs or promote products and services.","The sales personnel will be responsible for Answering client questions about credit terms, products, prices, availability and Preparing and submitting sales contracts for orders and Visiting clients and potential clients to evaluate needs or promote products and services.","14 March, 2024",+256-773-001186,True
WAITER,ELITE INTERNATIONAL CONSULTANTS JOB LINK LTD,./jobs?id=6466,Saudi Arabia,"17 Sep, 2024 - 17 Sep, 2026","Deadline : 31 Dec, 2025",SAR 1200,https://eemis.mglsd.go.ug/jobs?id=6466,WAITER,ELITE INTERNATIONAL CONSULTANTS JOB LINK LTD,Saudi Arabia,"Sep 17, 2024 - Sep 17, 2026 ",SAR 1200,Hospitality/Leisure/Travel,"The typical restaurant crew member completes a variety of food preparation, customer transaction and sanitation jobs. A main responsibility during the shift is to take customer orders and process payments. They may also work on preparing and expediting food orders. In between customers, crew members perform cleaning duties, such as clearing tables and sanitizing food preparation areas.","The typical restaurant crew member completes a variety of food preparation, customer transaction and sanitation jobs. A main responsibility during the shift is to take customer orders and process payments. They may also work on preparing and expediting food orders. In between customers, crew members perform cleaning duties, such as clearing tables and sanitizing food preparation areas.						","30 August, 2023",+256-775-715978,True
WAITRESSES,VBC LABOUR EXPERTS LIMITED,./jobs?id=6619,Saudi Arabia,"16 Jan, 2025 - 16 Jan, 2027","Deadline : 06 Feb, 2025",SAR 1200,https://eemis.mglsd.go.ug/jobs?id=6619,WAITRESSES,VBC LABOUR EXPERTS LIMITED,Saudi Arabia,"Jan 16, 2025 - Jan 16, 2027 ",SAR 1200,Other,"The typical restaurant crew member completes a variety of food preparation, customer transaction and sanitation jobs. A main responsibility during the shift is to take customer orders and process payments. They may also work on preparing and expediting food orders. In between customers, crew members perform cleaning duties, such as clearing tables and sanitizing food preparation areas.","The typical restaurant crew member completes a variety of food preparation, customer transaction and sanitation jobs. A main responsibility during the shift is to take customer orders and process payments. They may also work on preparing and expediting food orders. In between customers, crew members perform cleaning duties, such as clearing tables and sanitizing food preparation areas.						","14 March, 2024",+256-759-130850,True
family drivers,SWIFT INTERNATIONAL RECRUITERS LIMITED,./jobs?id=6530,Saudi Arabia,"19 Nov, 2024 - 19 Nov, 2026","Deadline : 30 Jun, 2025",SAR 1200,https://eemis.mglsd.go.ug/jobs?id=6530,family drivers,SWIFT INTERNATIONAL RECRUITERS LIMITED,Saudi Arabia,"Nov 19, 2024 - Nov 19, 2026 ",SAR 1200,Other,family drivers responsible for driving family and children to and from school .,family drivers responsible for driving family and children to and from school .						,"31 May, 2024",+256-392-174783,True
housemaid,INTERNATIONAL EMPLOYMENT LINKAGES (U) LTD,./jobs?id=6614,Saudi Arabia,"02 Jan, 2025 - 02 Jan, 2027","Deadline : 29 Jan, 2025",SAR 900,https://eemis.mglsd.go.ug/jobs?id=6614,housemaid,INTERNATIONAL EMPLOYMENT LINKAGES (U) LTD,Saudi Arabia,"Jan 02, 2025 - Jan 02, 2027 ",SAR 900,Domestic Worker,"Housemaid where her capacity of cleaning, washing, cooking and taking care of children and aged people to be provided  to client.","Housemaid where her capacity of cleaning, washing, cooking and taking care of children and aged people to be provided  to client.","28 February, 2024",+256-414-581258,True
housemaid,INTERNATIONAL EMPLOYMENT LINKAGES (U) LTD,./jobs?id=6614,Uganda,"Posted : 02 Jan, 2025","Deadline : 29 Jan, 2025",SAR 900,https://eemis.mglsd.go.ug/jobs?id=6614,housemaid,INTERNATIONAL EMPLOYMENT LINKAGES (U) LTD,Saudi Arabia,"Jan 02, 2025 - Jan 02, 2027 ",SAR 900,Domestic Worker,"Housemaid where her capacity of cleaning, washing, cooking and taking care of children and aged people to be provided  to client.","Housemaid where her capacity of cleaning, washing, cooking and taking care of children and aged people to be provided  to client.","28 February, 2024",+256-414-581258,False
housemaid,NASSER RECRUITMENT AGENCY LIMITED,./jobs?id=6624,Saudi Arabia,"10 Jan, 2025 - 10 Jan, 2027","Deadline : 07 Feb, 2025",SAR 900,https://eemis.mglsd.go.ug/jobs?id=6624,housemaid,NASSER RECRUITMENT AGENCY LIMITED,Saudi Arabia,"Jan 10, 2025 - Jan 10, 2027 ",SAR 900,Domestic Worker,HOUSE MAIDS NEEDED IN KINGDOM OF SAUDI ARABIA TO WORK ON A TWO-YEAR CONTRACT,HOUSE MAIDS NEEDED IN KINGDOM OF SAUDI ARABIA TO WORK ON A TWO-YEAR CONTRACT						,"16 August, 2024",+256-756-568009,True
housemaid,NASSER RECRUITMENT AGENCY LIMITED,./jobs?id=6624,Uganda,"Posted : 10 Jan, 2025","Deadline : 07 Feb, 2025",SAR 900,https://eemis.mglsd.go.ug/jobs?id=6624,housemaid,NASSER RECRUITMENT AGENCY LIMITED,Saudi Arabia,"Jan 10, 2025 - Jan 10, 2027 ",SAR 900,Domestic Worker,HOUSE MAIDS NEEDED IN KINGDOM OF SAUDI ARABIA TO WORK ON A TWO-YEAR CONTRACT,HOUSE MAIDS NEEDED IN KINGDOM OF SAUDI ARABIA TO WORK ON A TWO-YEAR CONTRACT						,"16 August, 2024",+256-756-568009,False
housemaid,TRUSTIN COMPANY LIMITED,./jobs?id=6535,Saudi Arabia,"02 Dec, 2024 - 02 Dec, 2026","Deadline : 15 Dec, 2028",SAR 900,https://eemis.mglsd.go.ug/jobs?id=6535,housemaid,TRUSTIN COMPANY LIMITED,Saudi Arabia,"Dec 02, 2024 - Dec 02, 2026 ",SAR 900,Domestic Worker,female domestic workers ,female domestic workers 						,"13 December, 2024",+256-776-027292,True
